0,1,2
20179302.6,"Collectively , our findings suggest that selenomethionine and alpha-tocopherol supplementation does not prevent prostate cancer in rats fed diets with nutritionally adequate levels of selenium and vitamin E. Importantly , the results of the current animal studies and those reported previously were fully predictive of the outcome of the Selenium and Vitamin E Cancer Prevention Trial .",['tumor promoting inflammation']
12536240.4,NK cells and CD56(+) T cells from tumour-bearing livers exhibited lymphokine-activated killing of K562 targets and T cell receptor-mediated lysis of P815 cells .,['avoiding immune destruction']
12536240.5,"The expression of CD94 and the KIR isotypes CD158a , CD158b and KIR3DL1 by CD56(+) T cells and NK cells was significantly and consistently reduced in tumour-bearing livers compared to healthy livers ( P<0.05 in all cases ) .",['avoiding immune destruction']
12536240.6,"Simultaneous ligation of CD158a , CD158b and KIR3DL1 caused an overall partial inhibition of CD56(+) T cell cytotoxic activity , suggesting that the observed reductions in KIR(+) cell numbers in malignancy are likely to lead to enhanced cytotoxicity .",['avoiding immune destruction']
12536240.7,"Our results suggest that , while hepatic CD56(+) T cells are not expanded in malignancy , downregulation of KIR and CD94 expression may be a mechanism by which the hepatic immune system can be activated to facilitate tumour rejection .",['avoiding immune destruction']
11901535.4,The serum concentrations of sIL-2R and the production of IL-10 were reduced ( p < 0.05 ) after 2 months of treatment .,['activating invasion and metastasis']
20308543.9,These results clearly indicate that the defect of the protective system against oxidative stress impaired survival of activated macrophages and subsequently enhanced tumorigenecity .,['tumor promoting inflammation']
22276155.6,"Antiestrogens at l nM induced the phosphorylation of the Src-Y416 residue , an event to activate Src , while at 5 �M induced Src-Y527 phosphorylation that inactivates Src .",['sustaining proliferative signaling']
22276155.9,Our results thus indicated that ER-α36 mediates biphasic antiestrogen signaling in the ER-negative breast cancer cells and Src functions as a switch of antiestrogen signaling dependent on concentrations of antiestrogens through the EGFR/STAT5 pathway .,['sustaining proliferative signaling']
24260485.4,"Accordingly , inhibition of endogenous CD43 expression by RNA interference in lung , cervix and colon human cancer cells impaired tumor growth in vivo .",['evading growth suppressors']
21063098.5,"Furthermore , anti-cancer activity mediated by periplocin was associated with decreased level of phosphorylated AKT and ERK both in vitro and in vivo , which were important for cell growth and survival .",['inducing angiogenesis']
21063098.6,"Moreover , periplocin induced apoptosis by downregulating Bcl-2 and upregulating Bax , leading to activation of caspase-3 and caspase-9 .",['sustaining proliferative signaling']
21063098.7,"These findings suggested that periplocin could inhibit the growth of lung cancer both in vitro and in vivo , which could be attributed to the inhibition of proliferation and the induction of apoptosis signaling pathway , such as AKT and ERK .",['resisting cell death']
21541970.6,"Leptin was then shown to exert clear pro-apoptotic effects , increasing levels of caspase 3 , cleavage of its substrate , poly ( ADP-ribose ) polymerase ( PARP ) to cleaved PARP(89) , levels of CK 18 , a cytoskeletal protein formed during apoptosis , and DNA condensation .",['sustaining proliferative signaling']
21541970.7,"Kinase inhibitors indicated that leptin-induced apoptosis is probably mediated by balanced activation of JAK2/STAT3 , p38 MAPK , and PKC pathways in PCa cells .",['resisting cell death']
21541970.8,"A human leptin mutein LRb antagonist , L39A/D40A/F41A , fully inhibited leptin-induced phosphorylation of JAK2 , ERK1/2 , and Akt/PKB , and partially abrogated effects on apoptotic proteins .",['sustaining proliferative signaling']
21541970.10,"Thus , AR may mediate , at least partly , the leptin-induced apoptotic response .",['resisting cell death']
21541970.11,CONCLUSIONS Leptin can clearly induce apoptosis in human PCa cell lines .,['resisting cell death']
20925001.11,"In one case , the advanced lymphocytic infliltration was observed within neoplastic tissue .",['resisting cell death']
20839428.13,"The differential diagnosis , considering the evidence described , included granulomatous or infectious diseases , angiocentric lymphoproliferative lesions , and lymphomas .",['avoiding immune destruction']
22372864.2,"The selected compound ( 19a ) showed excellent inhibitory activity toward HER-1/HER-2 tyrosine kinases with selectivity over 20 other kinases and inhibited the proliferation of both cancer cell types : lapatinib-sensitive cell lines ( SK-Br3 , MDA-MB-175 , and N87 ) and lapatinib-resistant cell lines ( MDA-MB-453 , H1781 , and H1975 ) .",['sustaining proliferative signaling']
22372864.3,"The excellent pharmacokinetic profiles of 19a in mice and rats led us to further investigation of a novel therapeutic agent for HER-2-targeting treatment of solid tumors , especially HER-2-positive breast/gastric cancer and HER-2-mutated lung cancer .",['sustaining proliferative signaling']
22251703.5,Topical imiquimod treatment led to TLR7-dependent and IFN-α/β receptor 1-dependent ( IFNAR1-dependent ) upregulation of expression of the chemokine CCL2 in mast cells .,['tumor promoting inflammation']
22251703.7,The recruited pDCs were CD8α+ and induced tumor regression in a TLR7/MyD88- and IFNAR1-dependent manner .,['tumor promoting inflammation']
20714148.4,"Sorafenib reduced c-Kit , ERK and VEGFR2 activation and on the other hand , gemcitabine inhibited Akt phosphorylation .",['resisting cell death']
20714148.5,"Moreover , quantitative PCR showed that sorafenib modulated the expression of genes related to gemcitabine activity , while gemcitabine induced the expression of RKIP .",['sustaining proliferative signaling']
22842620.3,This patient had lung adenocarcinoma with BAC ( bronchioloalveolar carcinoma ) features in the setting of a prior medical history significant for carotid stenosis and severe chronic obstructive pulmonary disease ( COPD ) .,['genomic instability and mutation']
22858678.5,"Unexpectedly , the quantitative loss of MALAT1 did neither affect proliferation nor cell cycle progression nor nuclear architecture in human lung or liver cancer cells .",['sustaining proliferative signaling']
22858678.6,"Moreover , genetic loss of Malat1 in a knockout mouse model did not give rise to any obvious phenotype or histological abnormalities in Malat1-null compared with wild-type animals .",['sustaining proliferative signaling']
22201685.4,"Mice lacking HuR in myeloid-lineage cells , which include many of the cells of the innate immune system , displayed enhanced sensitivity to endotoxemia , rapid progression of chemical-induced colitis , and severe susceptibility to colitis-associated cancer .",['tumor promoting inflammation']
22201685.5,The myeloid cell-specific HuR-deficient mice had an exacerbated inflammatory cytokine profile and showed enhanced CCR2-mediated macrophage chemotaxis .,['tumor promoting inflammation']
22201685.6,"At the molecular level , activated macrophages from these mice showed enhancements in the use of inflammatory mRNAs ( including Tnf , Tgfb , Il10 , Ccr2 , and Ccl2 ) due to a lack of inhibitory effects on their inducible translation and/or stability .",['tumor promoting inflammation']
22201685.7,"Conversely , myeloid overexpression of HuR induced posttranscriptional silencing , reduced inflammatory profiles , and protected mice from colitis and cancer .",['tumor promoting inflammation']
22201685.8,Our results highlight the role of HuR as a homeostatic coordinator of mRNAs that encode molecules that guide innate inflammatory effects and demonstrate the potential of harnessing the effects of HuR for clinical benefit against pathologic inflammation and cancer .,['tumor promoting inflammation']
23272224.5,"Moreover , genetic and pharmacological approaches were used to define the implication of BCDC in mediating the effects of SASP components on cell migration and resistance to drugs .",['enabling replicative immortality']
23272224.7,Beta catenin transactivation and expression of genes implicated in epithelial-mesenchymal transition ( EMT ) also increased in response to drug-induced SASP .,['enabling replicative immortality']
23272224.10,"Together , these findings provide insights on the potential role of BCDC in mediating the effects of drug-induced SASP on cancer cell invasion and resistance to therapy , and suggest that targeting this pathway may represent an effective approach to enhance the activity of current and prospective anti-cancer therapeutics .",['activating invasion and metastasis']
21042532.6,"Differentiation of pleomorphic sarcoma from a sarcomatoid renal cell carcinoma is , thus , challenging from cytopathology smears and the differential diagnoses should always be borne in mind while giving a cytopathological opinion .",['resisting cell death']
22489696.6,Using PI3K or IKK inhibitor reduced the level of phospho-Akt or phospho-IκBα as well as ECM1 .,['activating invasion and metastasis']
20943596.4,"In cord blood , we found significantly ( P < 0.01 ) higher levels of estradiol ( 44.2% ) , testosterone ( 54.5% ) , IGF-2 ( 22.7% ) and strikingly SHBG ( 104.6% ) in Shanghai women , whereas the opposite was true for IGF-1 ( -36.8% ) .",['sustaining proliferative signaling']
20943596.5,"CONCLUSIONS Taking into account the current understanding of the plausible biological role of the examined endocrine factors , those likely to be involved in the intrauterine origin of breast cancer are SHBG and IGF-2 , with higher cord blood levels among Chinese , and IGF-1 , with higher cord blood levels among Caucasian women .",['sustaining proliferative signaling']
20119958.4,"In contrast to the neutral comet assay , the alkaline comet assay is not related to the chromatin loops .",['genomic instability and mutation']
20119958.5,"Our results imply that the alkaline treatment induces detachment of the loops from the nuclear matrix , and the comet tail is formed by ssDNA fragments , the ends of which are pulled out from the comet head by electric force .",['genomic instability and mutation']
20922140.4,"According to the quartile category , the plasma IGF-1 level was significantly higher ( p=0.0015 ) in the CIN group than in the controls .",['sustaining proliferative signaling']
20922140.5,The IGFBP-3 level showed no association between the controls and CIN groups ( p=0.842 ) .,['sustaining proliferative signaling']
20922140.6,"Although the mean IGF-1/IGFBP-3 molar ratio had borderline significance ( p=0.08 ) among the study population , the quartile comparison showed a significantly higher IGF-1/IGFBP-3 molar ratio in the CIN group compared to the control group ( p=0.041 ) .",['sustaining proliferative signaling']
12097282.8,"As a strategy for blocking PDGFR signaling , CT52923 , a potent selective small molecule piperazinyl quinazoline kinase inhibitor of the PDGFR , was identified .",['sustaining proliferative signaling']
12097282.10,"More importantly , p.o. administration of CT52923 to nude mice caused a significant 61% reduction ( P < 0.006 ) in tumor growth of NIH/3T3 cells transformed by PDGF , whereas tumor formation by cells expressing v-fms was unaffected .",['sustaining proliferative signaling']
12097282.13,"The functional significance of PDGF autocrine signaling in these cells was demonstrated by the fact that the CT52923 inhibited soft agar colony formation , and , when given p.o. to nude mice , it effectively reduced tumor formation by 44% ( P < 0.0019 ) after s.c. injection of C6 glioblastoma cells .",['sustaining proliferative signaling']
22681312.6,"P2Y2 was found to be expressed on Treg cells , and we found a partial reduction of GvHD prevention when P2Y2(-/-) rather than P2Y2(+/+) Treg cells were given .",['tumor promoting inflammation']
22681312.7,"Exogenous local inflammation reduced Treg-cell accumulation in the tumour , suggesting a potential clinical approach to prevent Treg-cell-mediated tumour escape .",['tumor promoting inflammation']
22776956.6,"Because of the coexpression of β(2)-AR and cannabinoid receptors ( CBRs ) and their impact on HepG2 cell proliferation , these Gα(i)/Gα(o)-linked receptors may be implicated in MNF signaling .",['sustaining proliferative signaling']
22776956.7,"Cell treatment with ( R)-(+)-[2,3-dihydro-5-methyl-3-(4-morpholinylmethyl)pyrrolo[1,2,3-de]-1,4-benzoxazin-6-yl]-1-napthalenylmethanone ( WIN 55,212-2 ) , a synthetic agonist of CB(1)R and CB(2)R , led to growth inhibition , whereas inverse agonists of these receptors blocked MNF mitogenic responses without affecting Fen signaling .",['sustaining proliferative signaling']
23229340.10,"Moreover , miR-18a overexpression led to the upregulation of ATM expression and suppression of mTORC1 activity .",['resisting cell death']
23027128.8,Expression of FAK and Palm-PTK6-YF in Fak-/- MEFs synergistically activates AKT and protects cells against anoikis .,['evading growth suppressors']
20681796.8,"Taken together , these results demonstrate that experimentally immortalized human colon epithelial cells with a non-random chromosome 7 trisomy are valuable premalignant cellular reagents that can be used to study radiation-induced colorectal carcinogenesis .",['tumor promoting inflammation']
11850815.3,Direct binding of DeltaNp63 proteins to a p53 consensus motif was greater in proliferating cells than senescent cells .,['enabling replicative immortality']
11850815.4,In contrast p63alpha isoforms bound to DNA in a p53 dependent manner and this was higher in senescent cells than proliferating cells .,['enabling replicative immortality']
11850815.5,An interaction of p63alpha proteins with SV40 large tumour antigen was also detected and ectopic expression of DeltaNp63alpha can extend the lifespan of rat embryo fibroblasts .,['enabling replicative immortality']
1639009.3,"Antirat PRL , but not control antibody , markedly inhibited but did not eliminate cell proliferation , and this effect was diminished with increasing PRL concentration in the medium .",['sustaining proliferative signaling']
1639009.4,PRL receptors were demonstrated on 40-50% of the cells by indirect immunofluorescence using a specific antirat PRL receptor monoclonal antibody .,['sustaining proliferative signaling']
1639009.5,Cell surface PRL was colocalized to the same 40-50% of the cells and copatched or cocapped along with the receptors .,['sustaining proliferative signaling']
1639009.6,"Absence or presence of PRL receptors did not correlate with stage of the cell cycle , as judged by ethidium bromide dual labeling .",['sustaining proliferative signaling']
1639009.9,Thus we have established that PRL is an autocrine growth factor for at least 40-50% of the GH3 cell population .,['sustaining proliferative signaling']
1639009.10,"This , to our knowledge , is the first example of autocrine growth factor activity of a major hormone normotopically expressed .",['sustaining proliferative signaling']
22948721.4,"Patients with tumors bearing a KRAS p.G12D mutation showed a strong trend to a more favorable outcome compared to other mutations ( overall survival 23.3 vs. 14-18 months ; hazard ratio 0.66 , range 0.43-1.03 ) .",['genomic instability and mutation']
22948721.5,An interaction model illustrated that KRAS p.G12C was associated with unfavorable outcome when treated with oxaliplatin plus cetuximab .,['genomic instability and mutation']
12508543.5,The expression of E-cadherin was correlated inversely with the metastasis of breast carcinoma .,['activating invasion and metastasis']
12508543.7,The patients who had high expression of E-cadherin had a longer survival time .,['activating invasion and metastasis']
22840369.7,Eighteen treatments ( 17 patients ) were administered according to their molecular profile with evidence of activity in nine .,['genomic instability and mutation']
19836430.5,TNFalpha mediated increase in Akt phosphorylation was dependent on oxidative stress as Akt phosphorylation was abrogated in the presence of ROS inhibitor and elevated in cells transfected with SOD-1 siRNA .,['tumor promoting inflammation']
19836430.6,TNFalpha altered actin cytoskeletal organization and increased Cdc42 levels .,['tumor promoting inflammation']
19836430.9,"Importantly , Akt inhibition not only reversed TNFalpha mediated changes in actin cytoskeletal organization but also abrogated anchorage independent growth .",['tumor promoting inflammation']
20223881.5,Immunohistochemical staining for the Hh pathway components PTCH and GLI1 and the proliferation marker Ki67 demonstrated that patients diagnosed before the age of 10 had higher staining indices than those diagnosed after the age of 10 .,['resisting cell death']
20223881.6,"A significant correlation between Ki67 and PTCH and GLI1 staining indices was measured , and 86% of Ki67-positive cells also expressed PTCH .",['sustaining proliferative signaling']
22123926.3,"Wild-type p53 expression decreased levels of pyruvate dehydrogenase kinase-2 ( Pdk2 ) and the product of its activity , the inactive form of the pyruvate dehydrogenase complex ( P-Pdc ) , both of which are key regulators of pyruvate metabolism .",['cellular energetics']
1458472.6,"When injected s.c. into nude mice , R-type cells produce much larger tumors within the same period of time than E-type cells , and the tumors are less differentiated than those produced by the E-type cells .",['evading growth suppressors']
12495475.4,"While 17-beta-estradiol ( E2 ) did not significantly alter MRT cell line proliferation , the hydroxylated tamoxifen metabolite 4-OHT significantly inhibited the growth of all 6 MRT cell lines .",['sustaining proliferative signaling']
12495475.5,"However , the steroidal antiestrogen ICI 182 780 did not alter the proliferation of any of the MRT cell lines. 4-OHT induced apoptosis in both ER-alpha-negative and ER-alpha-positive MRT cell lines , as assessed by nuclear morphology and DNA fragmentation .",['sustaining proliferative signaling']
12415261.4,"CTL-mediated killing of endothelial cells indicated breaking of peripheral immune tolerance against this self antigen , resulting in markedly reduced dissemination of spontaneous and experimental pulmonary metastases .",['activating invasion and metastasis']
12368953.7,Median time to reach 100 CD4(+) cells was 8 months vs 4 months ( P = 0.03 ) .,['avoiding immune destruction']
12611083.3,Transduction of human endothelial cells with PEX virus suppressed endothelial invasion and formation of capillary-like structures without affecting chemotaxis in vitro .,['inducing angiogenesis']
12611083.4,Lentiviral delivery of PEX blocked basic fibroblast growth factor-induced matrix metalloproteinase 2 activation and angiogenesis on chicken chorioallantoic membranes .,['inducing angiogenesis']
12611083.5,PEX expression also inhibited tumor-induced angiogenesis and tumor growth in a nude mouse model .,['inducing angiogenesis']
12611083.6,"Thus , our study shows that lentiviral vectors can deliver sufficient quantities of antiangiogenic substances to achieve therapeutic effects in vivo .",['inducing angiogenesis']
23104055.3,The Tdp2 DNA-binding surface is highly tailored for engagement of 5'-adducted single-stranded DNA ends and restricts nonspecific endonucleolytic or exonucleolytic processing .,['genomic instability and mutation']
22668016.6,"In high grade control carcinoma cells , the expression of Ki67 increased by 37% ( non-significantly ) in comparison with control low grade carcinomas .",['resisting cell death']
1612500.11,Radical vulvectomy did not seem to improve survival over less radical procedures .,['activating invasion and metastasis']
12441195.4,"For purines , the results depend on the CE ( 2,3- or 3,4-catechols ) used , the function and configuration on carbon 17 ( ketone for estrone , alcohol for alpha and beta isomers of estradiol ) , and on the purine itself ( deoxyadenosine or deoxyguanosine ) .",['genomic instability and mutation']
12441195.6,"MS(2) and MS(3) experiments prove to be relevant for further structural determinations , enabling in some cases the elucidation of the regiochemistry of adduction on the A and B rings of the steroid moiety .",['genomic instability and mutation']
23386005.4,CONCLUSION The tests detecting mutations in exon 8 and 17 on the KIT gene were successfully standardized .,['genomic instability and mutation']
23386005.5,The test is now included among the routine diagnostics employed for patients at Hospital Israelita Albert Einstein clinical laboratory .,['genomic instability and mutation']
21220911.9,UC-MSCs increased phosphorylation of p38 MAPK in HL60 and K562 cells .,['evading growth suppressors']
12444953.2,"Further , we found that wavelengths in the UVA region of the solar spectrum ( 320-400 nm ) , devoid of UVB , were equally effective in activating immune suppression as UVA + UVB radiation .",['avoiding immune destruction']
12444953.3,Here we report on the mechanisms involved .,['avoiding immune destruction']
12444953.5,Antigen-specific suppressor T cells were found in the spleens of mice exposed to UVA + UVB radiation .,['avoiding immune destruction']
23772373.7,"Furthermore , EGFP markedly enhanced X-ray-induced cytotoxicity in the xrs-6 cells .",['genomic instability and mutation']
23772373.9,"Caution should be taken in considering of the potential influence by the stress response mechanism , namely , the Ku80-dependent elimination mechanism of EGFP-induced cytotoxicity , being activated , even when using EGFP-expressing cells in which Ku80 functions normally .",['genomic instability and mutation']
21058190.5,"However , quercetin did not inhibit the microtubule targeting of taxol or nocodazole .",['sustaining proliferative signaling']
23172666.3,"Inhibition of autophagy using 3-methyladenine increased BITC-induced apoptosis , whereas the administration of caspase inhibitor suppressed BITC-induced cell death .",['resisting cell death']
23172666.8,"Activation of the AKT survival pathway was only observed in PC3 cells , representing a resistance mechanism of advanced prostate cancer upon BITC treatment .",['resisting cell death']
20303211.11,"In contrast , tumor grade and tumor size were independently related to the presence of cystic EOC .",['resisting cell death']
22685175.6,"JAK inhibition abrogated phosphorylation of JAK/STAT and , surprisingly , of PI3K/mTOR pathway members , suggesting an interconnection between these signaling networks and providing a rationale for testing JAK inhibitors in clinical trials .",['sustaining proliferative signaling']
22685175.7,"The PI3K/mTOR pathway inhibitors rapamycin , PI103 , and PP242 also inhibited activated signal transduction and translational machinery proteins of the PI3K/mTOR pathway , suggesting that signal transduction inhibitors targeting this pathway also may have therapeutic relevance for patients with CRLF2-rearranged ALL and merit further preclinical testing .",['sustaining proliferative signaling']
23291974.5,STM-57 inhibited the phosphorylation of Akt and the mammalian target of rapamycin ( mTOR ) in CNE-2 cells .,['resisting cell death']
12161501.4,"Western blot analysis of cell cycle-regulatory proteins demonstrated that treatment with Cetrorelix ( 10(-5) M ) for 24 h did not change the steady-state levels of cyclin D1 , cyclin E , and cyclin-dependent kinase ( Cdk)4 but decreased the levels of cyclin A and Cdk2 .",['sustaining proliferative signaling']
12161501.5,"The protein levels of p21 ( a Cdk inhibitor ) and p53 ( a suppressor of tumor cell growth and a positive regulator for p21 expression ) were increased by Cetrorelix , but the levels of p27 ( a Cdk inhibitor ) did not change significantly .",['sustaining proliferative signaling']
12161501.6,Flow cytometric analysis and terminal deoxynucleotidyltransferase-mediated deoxyuridine 5-triphosphate nick end labeling staining demonstrated that Cetrorelix ( 10(-5) M ) induced apoptosis in HTOA cells .,['evading growth suppressors']
12161501.7,"In conclusion , Cetrorelix directly inhibits the proliferation of human epithelial ovarian cancer cells through mechanisms mediated by LH-RH receptor and involving multiple events in cell cycle progression , including G1 phase cell cycle arrest coupled with down-regulation of cyclin A-Cdk2 complex levels , presumably attributable to an up-regulation of p53 and p21 protein levels and apoptosis .",['resisting cell death']
23277201.6,"The inhibitory effect of Compound C on PDGFRβ and Akt was also observed in AMPKα(1)/α(2)-knockout mouse embryonic fibroblasts , indicating that its inhibitory effect is independent of the AMPK activity .",['sustaining proliferative signaling']
11914273.3,"BCL6 is frequently activated in non-Hodgkin's lymphoma , but its mechanism of action has remained unclear .",['enabling replicative immortality']
11914273.5,"BCL6 overrides the senescence response downstream of p53 through a process that requires induction of cyclin D1 expression , as cyclin D1 knockout fibroblasts are specifically resistant to BCL6 immortalization .",['enabling replicative immortality']
11914273.7,Our results suggest that BCL6 contributes to oncogenesis by rendering cells unresponsive to antiproliferative signals from the p19(ARF)-p53 pathway .,['sustaining proliferative signaling']
22357207.5,"Furthermore , the effects of leptin on proliferation and apoptosis of HCT-116 colon carcinoma cells were determined .",['activating invasion and metastasis']
