0,1,2
22927549.4,"This activity required natural killer ( NK ) cells and interferon γ ( IFN-γ ) , which mediated the induction of M1 macrophages .",['avoiding immune destruction']
20798497.5,"The activation of both these PKC isozymes was closely associated with the stimulation of proliferation and the cell cycle progression induced by PMA in GH3B6 cells , an effect that was blocked by the inhibitors of PKCalpha ( Gö6976 ) and PKCe ( eV1-2 ) .",['sustaining proliferative signaling']
20798497.6,"In addition , the pretreatment with the inhibitor of ERK1/2 ( PD98059 ) prevented the mitogenic activity induced by treatment with PMA for 15 min .",['sustaining proliferative signaling']
20351312.3,"This metabolic switch depends on the phosphatidyl inositol 3'-kinase/Akt pathway , is antagonized by the adenosine monophosphate ( AMP)-activated protein kinase ( AMPK ) , and is required for DC maturation .",['cellular energetics']
20351312.5,Our data pinpoint TLR-mediated metabolic conversion as essential for DC maturation and function and reveal it as a potential target for intervention in the control of excessive inflammation and inappropriately regulated immune responses .,['tumor promoting inflammation']
23275086.9,"However , overexpression of PTEN inhibited proliferation of human ASMCs cultured in vitro and was associated with downregulation of Akt phosphorylation levels , while did not affect ERK1/2 phosphorylation levels .",['resisting cell death']
23275086.10,"Moreover , overexpression of PTEN could induce ASMCs arrested in the G0/G1 phase through the downregulation of Cyclin D1 and upregulation of p21 expressions .",['sustaining proliferative signaling']
1373558.2,These data argue that certain immune defects may be involved in the development of myeloma and are not simply a consequence of overt malignancy .,['avoiding immune destruction']
21076414.4,"The unimpeded migration of metastatic PC-3 cells towards fibroblasts is dependent on activation of EphB3 and EphB4 by ephrin-B2 , which we show activates Cdc42 and cell migration .",['evading growth suppressors']
21076414.5,Knockdown of EphB3 and EphB4 restores contact inhibition of locomotion to PC-3 cells .,['activating invasion and metastasis']
21076414.7,"Thus , the migration of cancer cells can switch from restrained to invasive , depending on the Eph-receptor profile of the cancer cell and the reciprocal ephrin ligands expressed by neighbouring cells .",['evading growth suppressors']
11877436.2,"In contrast , treatment with a low concentration ( 20 nm ) of CPT induced cell cycle arrest and senescence of the wt HCT116 cells , but apoptosis of the p53(-/-) HCT116 and p21(-/-) HCT116 cells .",['resisting cell death']
11877436.4,"Interestingly , blocking of the apoptotic pathway , by Z-VAD-FMK , in p21(-/-) HCT116 cells following treatment with 20 nm CPT did not permit the cells to develop properties of senescence .",['resisting cell death']
22773298.5,"The patient responded quickly to symptomatic treatment with analgetics and heparin ; however , elevations of LDH and D-Dimer persisted for 1.5 and 8 months , respectively .",['resisting cell death']
22398780.7,The results of the study of ERβ on migration and invasion of HCT-116 cells demonstrated that overexpression of ERβ significantly decreased cell migration and increased invasion of cells .,['resisting cell death']
22398780.8,The antitumor efficacies of ERβ as well as raloxifene were further investigated on HCT-116 tumor bearing mice .,['activating invasion and metastasis']
22888341.8,The intratumoral microvessel density was higher in normal saline group than in N-desulfated heparin group ( P < 0.05). bFGF expression in gastric tissue was inhibited by N-desulfated heparin ( P < 0.05 ) .,['activating invasion and metastasis']
22888341.11,Conclusions .,['inducing angiogenesis']
22970388.8,Primary tumor samples were available for four of the six patients assessed for PIK3CA status in their bone metastases .,['genomic instability and mutation']
22970388.9,"For each of these , the PIK3CA mutation status was the same in the primary and metastatic sites .",['activating invasion and metastasis']
1403541.10,"The median survival for the overall group was 16 months , whereas that for those undergoing complete resection was 33 months .",['activating invasion and metastasis']
1403541.12,In the overall group these variables as well as resectability and distant metastases were significant in univariate analysis .,['activating invasion and metastasis']
1403541.14,"Thus , either variable ( but not both ) of each pair added information to the multivariate model .",['activating invasion and metastasis']
12660017.5,The high cytotoxic potential can be attributed to the enhanced DNA binding and sequence recognition capacity of the cationic compounds .,['genomic instability and mutation']
22422053.6,"Furthermore , we observed that the Flt3-induced inhibition of proliferation in HL-60 cells appeared to be Bax-dependent .",['resisting cell death']
22277962.7,An increased level of DNA oxidation lesions detected in Cos-1 and TK6 cells indicates that the leading mechanism by which TiO(2) NPs trigger genotoxicity is most likely oxidative stress .,['genomic instability and mutation']
22951839.7,The AAE6 variant protein alone pushed PHFKs through transformation and significantly increased their migration ability over that of the E6 prototype .,['enabling replicative immortality']
23565596.5,These results demonstrate that the fibroin surface shows higher potential to enhance cell migration and the production of ECM than a collagen or fibronectin surface .,['activating invasion and metastasis']
20035374.6,Pro-metastatic effects occurred when hepatic colonization with B16M cells place after the peak of TNF-alpha and IL-18 levels had been reached in the hepatic blood of fungal challenged mice .,['activating invasion and metastasis']
20035374.9,"Significantly , the fungal challenge had pro-metastatic effects without the C. albicans being able to reach the liver , suggesting that soluble factors can promote metastasis in remote sites .",['activating invasion and metastasis']
20035374.11,"Therefore , the pro-inflammatory microenvironment generated by the host's systemic response to C. albicans stimulates circulating cancer cells to metastasize in the liver .",['activating invasion and metastasis']
22841394.8,A conspicuous finding of this study involves lack of cardiotoxicity of PE as assessed by monitoring cardiac function using noninvasive echocardiography .,['tumor promoting inflammation']
22841394.10,"Data presented here coupled with those of our earlier study underline the importance of simultaneously targeting two interconnected molecular circuits , namely , Nrf2-mediated redox signaling and NF-κB-regulated inflammatory pathway , by pomegranate phytoconstituents to achieve chemoprevention of HCC .",['tumor promoting inflammation']
12531021.2,We have also found that cell lines derived from skin cancers in UVB-irradiated XPA(-/-) mice become tolerant to UV-irradiation and showed abnormal UV-induced cell cycle checkpoints and decreased mismatch repair ( MMR ) activity .,['genomic instability and mutation']
23300633.4,Luteolin also inhibited ex vivo angiogenesis as revealed by chicken egg chorioallantoic membrane assay ( CAM ) and matrigel plug assay .,['inducing angiogenesis']
23300633.5,Gelatin zymographic analysis demonstrated the inhibitory effect of luteolin on the activation of matrix metalloproteinases MMP-2 and MMP-9 .,['inducing angiogenesis']
23300633.10,"Moreover , luteolin reduced cell viability and induced apoptosis in prostate cancer cells , which were correlated with the downregulation of AKT , ERK , mTOR , P70S6K , MMP-2 , and MMP-9 expressions .",['inducing angiogenesis']
23300633.11,"Taken together , our findings demonstrate that luteolin inhibits human prostate tumor growth by suppressing vascular endothelial growth factor receptor 2-mediated angiogenesis .",['resisting cell death']
21197417.7,"Exposure of the EA.hy926 cells to pIFN-α was associated with an enlarged , multinucleated , β-galactosidase-positive senescent phenotype .",['enabling replicative immortality']
21197417.8,The overall therapeutic mechanism of IFN-α combined with chemotherapy may be due to both direct tumor cell death via IRF-1 signaling and by premature senescence of endothelial cells and subsequent effects on angiogenesis in the tumor microenvironment .,['enabling replicative immortality']
12815293.3,"It is suggested that decrease in DPH polarization in membrane , reduction in SOD activity and increased apoptosis in cervical cells of cancer patients treated with radiation may be consequent to oxidative damage induced by reactive oxygen species ( ROS ) , which may have implications in developing predictive protocol in cancer radiotherapy .",['resisting cell death']
23268564.4,"In addition , the chimeric protein was able to coat professional antigen-presenting cells through the Fc receptor to activate antigen-specific CD8+ T cells .",['avoiding immune destruction']
12509233.5,"Furthermore , deletion of the extreme carboxy-terminal domain totally abolished XPC activity in the cell-free NER reaction .",['genomic instability and mutation']
12006491.6,"Taken together , our data establish the SIRT1 deacetylase as a novel negative regulator of p53 function capable of modulating cellular senescence .",['enabling replicative immortality']
20188144.8,"CONCLUSIONS Our data establish that both fat-loading and suboptimal selenium status enhance collagen and IL-8 production by C3A hepatocytes in response to TGFbeta1 , possibly as part of an epithelial to mesenchymal transition .",['tumor promoting inflammation']
12634122.7,Mixture-treated cells showed increased expression of a variety of genes including metallothioneins and integrin 4 .,['genomic instability and mutation']
12069693.4,These results suggest a link between RAR signaling and the effect of T on LNCaP cell growth .,['sustaining proliferative signaling']
12069693.7,"In contrast , EGF-R was suppressed by 100 nM RA that also suppressed the effect of T. CONCLUSIONS Current results demonstrate interactions between T and RA in the expression of RARs and cell growth in LNCaP cells .",['sustaining proliferative signaling']
21480565.7,Our data indicate a role for ΔNp63 in modulating p53-dependent gene expression and influencing whether a cell death or cell cycle arrest program is initiated .,['evading growth suppressors']
21412013.4,"We also identified several novel genes whose expression was downregulated in NSCLC , including SGCG , NLRC4 , MMRN1 , and SFTPD , which are involved in extracellular matrix formation , apoptosis , blood vessel leakage , and inflammation , respectively .",['genomic instability and mutation']
1319408.3,"When cultured in a gel of matrigel , they proliferated and formed branched and invasive colonies .",['evading growth suppressors']
1319408.4,"In contrast , the parental NIH-3T3 cells cultured on matrigel remained as cell aggregates and were not invasive .",['activating invasion and metastasis']
1319408.5,"I.V. injections of the tumor-derived NIH-3T3 cells produced many colonies on the surface of the lungs , whereas the parental NIH-3T3 cells were not metastatic .",['activating invasion and metastasis']
1319408.6,Zymographic analysis of the conditioned media obtained from both the tumor-derived and parental NIH-3T3 cells demonstrated higher amounts of the 72-kDa gelatinase ( type-IV collagenase ) enzyme in the tumor-derived cells .,['activating invasion and metastasis']
23232078.6,"Ginseng also reduced mRNA levels of angiogenic factors ( e.g. , VEGF-A and FGF-2 ) and MMPs ( e.g. , MMP-2 and MMP-9 ) , whereas it increased mRNA levels of angiogenic inhibitors ( e.g. , TSP-1 , TIMP-1 , and TIMP-2 ) in adipose tissues .",['inducing angiogenesis']
23161498.5,Tumors were only observed in females of more than two winters .,['tumor promoting inflammation']
23033490.10,"In all these assays , dexamethasone effects were abolished by a glucocorticoid receptor antagonist or glucocorticoid receptor knockdown via RNA interference .",['activating invasion and metastasis']
19895865.7,"By analyzing the production of interleukin-6 and activity of lactate dehydrogenase and caspase , we confirmed that co-treatment intensified pulmonary injury and that it was accompanied by oxidative stress , as confirmed by marked increases in the production of reactive oxygen species , reduced glutathione content , and thioredoxin reductase ( TRXRD ) activity .",['tumor promoting inflammation']
19895865.8,"Expressed mRNA levels of heme oxygenase-1 , glutamylcysteine ligase , glutathione peroxidase 2 , thioredoxin ( TRX ) 1 , and TRXRD1 were also enhanced by co-treatment , whereas treatment with As(V) alone reduced the mRNA expression level of TRX2 .",['tumor promoting inflammation']
19895865.9,Our data suggest that co-treatment with As(V) exacerbated Cr(VI)-induced pulmonary injury and that this effect may be exerted through a disruption in the balance among several antioxidant genes .,['tumor promoting inflammation']
23231968.6,"Besides , the proliferation and Th1 cytokines productions ( e.g .",['inducing angiogenesis']
23231968.10,"In summary , our data provide the first evidence that bigelovin possesses anti-angiogenic and immunomodulatory activities , suggesting bigelovin may exert multi-target functions against cancer in animal models .",['tumor promoting inflammation']
11980647.7,"However , PC3 cells transfected with the androgen receptor ( PC3-AR2 ) exhibited a G2/M arrest and a marked reduction ( 57% ) in the S phase during cell cycle progression .",['sustaining proliferative signaling']
11980647.9,These data suggest that selenium possesses strong antiproliferative properties in regard to human PCA .,['evading growth suppressors']
11980647.11,This provides a theoretical basis for Phase III studies of selenium in PCA prevention .,['sustaining proliferative signaling']
11986236.5,"Neither helical domain alone mediated immortalization , and deletion of the 29-amino acid leucine zipper within this region completely abrogated transforming activity .",['enabling replicative immortality']
23300545.6,"Therefore , the elevation in inflammatory serum biomarkers may reflect a pathological state that decreases the clinical efficacy of this therapy .",['tumor promoting inflammation']
23175176.7,"The sum of risk alleles in these genes significantly correlated with the log-adduct level ( r = 0.4 , p < 0.001 ) .",['genomic instability and mutation']
23175176.10,"Female non-smokers in this population had PAH-related DNA adduct levels three to four times higher than smokers and occupationally-exposed groups in previous studies , with large inter-individual variation which could best be explained by a combination of Phase I genes and NER capacity .",['genomic instability and mutation']
12183074.2,The percentage of ERbeta positive tumors was 70.3% in masses from control animals vs. 50.0% in tumors from soy exposed animals ( P=0.066 ) .,['sustaining proliferative signaling']
12183074.3,"Moreover , the percentage of cases which were both ERalpha and ERbeta positive was significantly lower ( 17.6% ) in soy treated than in control animals ( 51.3% ) ( P=0.006 ) .",['sustaining proliferative signaling']
12183074.4,The percentage of PR positive tumors was 34.2% in control animals vs. 2.6% in tumors from soy treated rats ( P=0.0006 ) .,['sustaining proliferative signaling']
12183074.5,"There were no statistically significant differences in the percentage of tumors positively stained for neu , apoptosis , or PCNA , in control vs. soy treated rats .",['sustaining proliferative signaling']
12183074.8,"Moreover , an association was found between PCNA and neu status since all neu positive tumors were also PCNA positive ( P=0.011 ) .",['sustaining proliferative signaling']
22550599.7,"On the other hand , the concentration of sTie2 decreased on the 7th day after resection and did not change statistically later on .",['inducing angiogenesis']
22550599.9,Lung cancer resection results in proangiogenic plasma protein changes that may stimulate tumor recurrences and metastases after early resection .,['inducing angiogenesis']
20852630.4,"Stimulation of the MEK/ERK pathway strongly promoted Lys 63-linked ubiquitylation of RACO-1 , which antagonized Lys 48-linked degradative auto-ubiquitylation of the same Lys residues .",['sustaining proliferative signaling']
22884369.3,"The binding of STIP1 to ALK2 activated the SMAD signaling pathway , leading to transcriptional activation of ID3 ( inhibitor of DNA binding 3 ) , promoting cell proliferation .",['sustaining proliferative signaling']
23023480.10,"Our results indicate that hypoxia upregulates CXCR4 in gastric cancer cells in a HIF-1α-dependent manner , and that upregulation of CXCR4 plays a role in cancer cell migration and invasion .",['activating invasion and metastasis']
23023480.11,"Thus , disrupting the hypoxia-HIF-1α-CXCR4 axis could be an attractive therapeutic strategy for the treatment of gastric cancer .",['activating invasion and metastasis']
12581481.6,The absence of strand breakage after 48 h of exposure is discussed in the light of the underlying mechanisms of copper toxicity and DNA repair .,['genomic instability and mutation']
12581481.8,"Information gained from the use of this biomarker would help with the interpretation of chronic toxicity tests and would contribute to our understanding of the impact of genotoxic insult in marine invertebrates , particularly crustaceans .",['genomic instability and mutation']
22769410.7,"CONCLUSIONS The results are suggestive of important roles that MMP-2 , MMP-10 , TIMP-2 , and podoplanin play in pathologic processes of OSCC , including invasion .",['activating invasion and metastasis']
22769410.8,Our findings also suggest that LVD may play a role in lymphatic metastasis and tumor progression .,['activating invasion and metastasis']
23258707.3,"Most important , we found that pol \u03b2 not only bypassed one part of the large template hairpin but also managed to pass through almost the entire length of small hairpin .",['genomic instability and mutation']
19720422.6,Univariate analysis in 61 patients identified a group of innate immune genes whose expression within tumours is positively associated with patient survival .,['avoiding immune destruction']
19720422.11,"NK and CD8(+) T cell densities are correlated positively with tumour apoptosis , and negatively with tumour proliferation .",['avoiding immune destruction']
23300791.7,The study has uncovered a novel and unexpected function of Ascl1 which will contribute to better understanding of lung carcinogenesis and the broad implications of transcription factors in tobacco-related carcinogenesis .,['genomic instability and mutation']
1463101.8,Our data also suggest that IL-1 may have a central role in regulating the local immune response through the enhancement or induction of cytokine production by tumor and/or resident tissue cells .,['avoiding immune destruction']
20952396.5,Induction of p21 is linked to simultaneous acetylation and phosphorylation of histone H3 .,['evading growth suppressors']
20952396.6,"The dual modification mark H3S10phK14ac at the activated p21 promoter is recognized by the phospho-binding protein 14-3-3ζ , which protects the phosphoacetylation mark from being processed by PP2A .",['evading growth suppressors']
11929832.6,"This study , by targeting immortal murine cells for telomerase inhibition , demonstrates the importance of telomerase to murine cell immortalization and telomere maintenance .",['resisting cell death']
11929832.7,"Moreover , the murine model used here should prove useful in further evaluating telomerase inhibition as an anticancer therapy .",['enabling replicative immortality']
20574928.5,Gene expression alterations in PC3 and LNCaP cells treated with 15 muM DHC and 25 microM fisetin for 6 to 24 h were determined by oligonucleotide array .,['enabling replicative immortality']
23124112.4,"Furthermore , we demonstrate that autophagy induced by UCP2 inhibition determines a ROS-dependent cell death , as indicated by the apoptosis decrease in the presence of the autophagy inhibitors chloroquine ( CQ ) or 3-methyladenine ( 3-MA ) , or the radical scavenger NAC .",['resisting cell death']
23124112.6,Our results demonstrate for the first time that UCP2 plays a role in autophagy regulation bringing new insights into mitochondrial uncoupling protein field .,['resisting cell death']
20204879.4,The use of random oligonucleotide-primed synthesis for the analysis of DSB levels is described .,['genomic instability and mutation']
22876288.6,"Conversely , inhibition of miR-7 in the HBL-100 mammary epithelial cell line promoted cell proliferation and anchorage independent growth .",['activating invasion and metastasis']
20640572.4,IDO loss had limited impact on tumor outgrowth in carcinogenesis models that lacked an explicit inflammatory tumor promoter .,['tumor promoting inflammation']
23254288.8,"Codepletion of PAK4 and MMP-2 resulted in robust anoikis-mediated cell death , and severely inhibited invasive and migratory properties in these cells .",['resisting cell death']
23254288.9,"PAK4si inhibited in vivo tumor growth in nude mice by inhibiting MMP-2 , β3-integrin and phospho-EGFR levels in tumors .",['activating invasion and metastasis']
11927016.4,"This was associated with a decrease in cyclin D1 , an increase in p27(Kip1) and a reduction in the hyperphosphorylated form of retinoblastoma protein ( pRB ) .",['sustaining proliferative signaling']
11927016.6,"Both ATRA and 5-FU activated c-Jun N-terminal kinase ( JNK ) 1 and the combination of both agents resulted in additive or synergistic activation of JNK1 , and also enhanced the induction of apoptosis .",['resisting cell death']
23082676.2,"In addition to chromosomal structural abnormalities , there are genomic changes ( aneuploidy , polyploidy ) .",['genomic instability and mutation']
23082676.3,"There is a tendency towards an increased rate of petroleum-induced chromosomal aberrations in a number of generations ( P , F1 , and F2 ) in the rat bone marrow cells .",['genomic instability and mutation']
23082676.4,"The maximum mutagenic effect of volatile petroleum fractions was found when used at concentrations of 10 and 100 mg/l upon long-term chronic exposure during three generations ( P1 , F1 , and F2 ) .",['genomic instability and mutation']
23082676.5,"The findings are indicative of the mutagenic activity of volatile petroleum fractions , which is likely to pose a potential risk from environmental pollution to biota and population health in the area of intensive oil extraction and refining .",['genomic instability and mutation']
20432174.9,"Finally , low Pi increased lung tumorigenesis in K-ras(LA1) mice compared to the normal diet group .",['sustaining proliferative signaling']
22949905.5,Encouraged by these results we started a therapy using FOLFIRI in combination with cetuximab .,['genomic instability and mutation']
22949905.12,Potential predictive factors of the immunochemotherapy are discussed in this paper .,['activating invasion and metastasis']
21116849.4,Transaminase activity was measured and histopathological examination was done after IR .,['resisting cell death']
1328987.4,Yet they proved capable of transforming both primary and established fibroblasts in culture .,['enabling replicative immortality']
24164383.9,"HH signaling was also enhanced by alcohol exposure , as evidenced by increased levels of mRNAs encoding HH ligands , HH-regulated transcription factors , and HH target genes .",['tumor promoting inflammation']
12450390.5,"The mutational frequency varied , depending on the position modified in the Nar I site ; 91% two-base deletions were observed at G(3) , while 8.4% and 2.8% deletions were detected at G(2) and G(1) , respectively .",['genomic instability and mutation']
12450390.8,"Mutation frequencies for dG-AAF were 9.4-24% , the highest values being at G(1) and G(3) .",['genomic instability and mutation']
12450390.10,"We conclude from this study that the mutation potential of dG-AAF and dG-AF depends on the structure of the adduct , the sequence context of the lesion , and the host cell used for the experiment .",['genomic instability and mutation']
24316222.6,The ability of lincRNA-p21 to promote tumor growth is validated in mouse xenograft models .,['cellular energetics']
1447316.1,"Apoptosis induced in BM13674 cells by these diverse agents was markedly inhibited by 1 microM okadaic acid , a tumour promoter that inhibits protein phosphatases 1 and 2A .",['resisting cell death']
1447316.2,This compound also inhibited the appearance of apoptosis in fresh human leukaemia cells that had been exposed to gamma-radiation .,['resisting cell death']
1447316.3,The inhibition of apoptosis was confirmed using fluorescence microscopy and DNA gel electrophoresis .,['resisting cell death']
1447316.5,Previous studies on the BM13674 cell line showed that an inhibitor of protein synthesis failed to prevent apoptosis in these cells .,['resisting cell death']
1370093.2,Expression of these proteins may be involved in senescence .,['enabling replicative immortality']
21816206.3,RMC1 also induced the depletion of mitochondrial membrane potential in A549 cells by regulating the expression of pro-survival and pro-apoptotic Bcl-2 family members .,['resisting cell death']
21816206.5,"These results demonstrated that RMC1 induced cancer cell death by acting on both mitochondrial and death receptor apoptotic pathways , suggesting that RMC1 could be a candidate for further evaluation as a chemotherapeutic agent against human cancers .",['resisting cell death']
