0,1,2
14694722.4,CONCLUSIONS Styrene formed adduct with DNA through its active center metabolite--SO after entering the body .,['genomic instability and mutation']
20199942.5,"When introduced into nude mice , transformed cells were tumorigenic .",['evading growth suppressors']
22139427.6,"With increasing concentration of cucurmosin , the expression of EGFR , p-PI3K , Akt , p-Akt , mTOR , p-mTOR , P70S6K-α , p-P70S6K-α , 4E-BP1 and p-4E-BP1 at the protein level was decreased , whereas the expression of p-Bad and caspase-9 was elevated .",['sustaining proliferative signaling']
22139427.9,Cucurmosin induces the apoptosis of BxPC-3 pancreatic cancer cells via the PI3K/Akt/mTOR signaling pathway .,['sustaining proliferative signaling']
20706593.5,"A single DSS cycle induced severe acute ulcerative colitis in wild-type mice , whereas lesions were modest in Mutyh(-/-) mice , and this was associated with moderate variations in the expression of several cytokines .",['genomic instability and mutation']
12643451.5,The altered expression of these genes maybe associated with cellular proliferation or differentiation and the early stages of oral carcinogenesis .,['enabling replicative immortality']
22407299.8,Our study provided the first glimpse of the functional role of miR-133 in two hormone-independent prostate cancer cell lines .,['sustaining proliferative signaling']
22355784.3,"Our results have implications for the role of the electronic properties of DNA in cellular processes , and hint at the possibility of prediction , early diagnosis and detection of mutation hotspots .",['genomic instability and mutation']
20856226.6,EGF also increased proliferative abilities and invasive properties of the HCC cell lines .,['sustaining proliferative signaling']
20856226.7,"In vivo , 9 ( 12% ) of 78 HCC cases showed positive immunohistochemical staining of CK19 .",['activating invasion and metastasis']
20856226.10,"These results indicate that the activation of the EGF-EGFR signaling pathway is associated with the development of CK19-positive HCC , and the EGF-induced increase in growth abilities of HCC may account for the poor prognosis of the patients .",['activating invasion and metastasis']
20080744.3,"Furthermore , we have coexpressed Cdh1 with PFKFB3--either wild-type or a mutant form resistant to ubiquitylation by APC/C-Cdh1--or with the glycolytic enzyme 6-phosphofructo-1-kinase and demonstrated that whereas glycolysis is essential for cell proliferation , its initiation in the presence of active Cdh1 does not result in proliferation .",['cellular energetics']
20080744.4,"Our experiments indicate that the proliferative response , regardless of whether it occurs in normal or neoplastic cells , is dependent on a decrease in the activity of APC/C-Cdh1 , which activates both proliferation and glycolysis .",['cellular energetics']
20080744.5,"These observations have implications for cell proliferation , neoplastic transformation , and the prevention and treatment of cancer .",['cellular energetics']
23145148.6,"Inhibition of the NHEJ factor DNA-PK , under conditions of MMS-induced PARP-1 hyperactivation , enhanced necrotic cell death .",['genomic instability and mutation']
11914642.5,These results suggest that PPARgamma can augment TNF-family-induced apoptosis .,['resisting cell death']
22980794.4,These data suggested that the Pu-erh tea reversed the immunosenescence by restoring the immune deficiency and decreasing pro-inflammatory cytokine .,['avoiding immune destruction']
20205737.7,Plasma C-reactive protein concentration was lower ( P < 0.05 ) on wk 8 in subjects given 2 mg astaxanthin .,['genomic instability and mutation']
20205737.8,"Dietary astaxanthin stimulated mitogen-induced lymphoproliferation , increased natural killer cell cytotoxic activity , and increased total T and B cell subpopulations , but did not influence populations of Thelper , Tcytotoxic or natural killer cells .",['tumor promoting inflammation']
21152298.10,"In conclusion , LeY plays an important role in promoting cell proliferation , tumorigenecity and adhesion , and these effects may be related to increased levels of growth factors .",['sustaining proliferative signaling']
21152298.11,The LeY antibody shows potential application in the treatment of LeY-positive tumors .,['sustaining proliferative signaling']
12579213.8,"It was found that the NK cell number was low in the tumor but higher around the tumor in early gastric carcinomas , compared with advanced carcinomas ( p>0.05 ) .",['activating invasion and metastasis']
23224295.7,Data from bladder cancer human biopsies revealed that B(1) receptor expression was increased in all tumor samples and under conditions of chronic inflammation .,['sustaining proliferative signaling']
23224295.10,"Kinin receptors , especially B(1) receptors , appear to be implicated in bladder cancer progression .",['sustaining proliferative signaling']
23224295.11,It is tempting to suggest that selective kinin antagonists might represent potential alternative therapies for bladder cancer .,['sustaining proliferative signaling']
20339958.8,"All cases of NPC were positive for 8-NitroG and 8-OHdG , and 54 ( 94.7% ) were positive for iNOS .",['genomic instability and mutation']
20339958.13,This may contribute to the cause and development of NPC .,['tumor promoting inflammation']
20389043.6,"Moreover , the HRR pathway seems to play a role in cellular resistance to DBPDE mainly in terms of chromosomal aberration induction while the NHEJ pathway takes part affecting only the induction of SCEs .",['genomic instability and mutation']
12191570.1,The concentration of IFN-gamma that effectively inhibited the proliferation of BALM-3 cells was 1/40 of that required for BALM-1 cells .,['resisting cell death']
23121427.5,"Watson-Crick base pairing of the modified guanine with the partner cytosine is broken , but these bases retain some stacking with the bulky DB[a,l]P ring system .",['genomic instability and mutation']
23121427.7,"The structural considerations that lead to the intercalated conformation of the DB[a,l]P-dG lesion in contrast to the minor groove alignment of the B[a]P-dG adduct , and the implications of the DB[a,l]P-dG conformational motif for the recognition of such DNA lesions by the human nucleotide excision repair apparatus , are discussed .",['genomic instability and mutation']
23264896.6,Cells were then treated with varying amounts of the SPA4 peptide .,['tumor promoting inflammation']
23264896.10,"Rather , its binding to TLR4 inhibits the LPS-induced phosphorylation of p65 , production of IL-1β and IL-6 , activity of NFκB , migration and invasion of SW480 cells .",['activating invasion and metastasis']
22969849.6,Pan-caspase blocking completely abrogates LYTF-induced apoptosis and partially abrogates LYTF-induced proliferation inhibition .,['resisting cell death']
12548019.3,Plk3 physically interacts with Chk2 and the interaction is enhanced upon DNA damage .,['tumor promoting inflammation']
12548019.4,"In addition , Chk2 immunoprecipitated from cell lysates of Daudi ( which expressed little Plk3 ) is capable of stimulating the kinase activity of purified recombinant Plk3 in vitro , and this stimulation is more pronounced when Plk3 is supplemented with Chk2 immunoprecipitated from Daudi after DNA damage .",['genomic instability and mutation']
12548019.6,"Together , our studies suggest Chk2 may mediate direct activation of Plk3 in response to genotoxic stresses .",['genomic instability and mutation']
21195710.5,"Both placenta and recombinant laminin-511 preparations were highly active , and the isolated recombinant IVa domain of LMα5 also promoted cell migration .",['sustaining proliferative signaling']
21195710.6,"Function-blocking antibodies in cell migration assays revealed α6β1 integrin as the major receptor for laminin-111 , and both α3β1 and α6β1 integrins for laminin-332 and laminin-511 .",['activating invasion and metastasis']
21195710.7,"In contrast , isolated LMα5 IVa domain-promoted melanoma cell migration was largely mediated via αVβ3 integrin and inhibited by RGD peptides .",['activating invasion and metastasis']
21195710.8,"Given the ubiquitous expression of α5 laminins in melanoma cells and in melanoma-target tissues/anatomical structures , as well as the strong migration-promoting activity of these laminin isoforms , the α5 laminins emerge as putative primary extracellular matrix mediators of melanoma invasion and metastasis via α3β1 and other integrin receptors .",['activating invasion and metastasis']
1355514.4,Cells transfected with EJ ras alone showed no morphological alterations nor significant changes in radiosensitivity .,['enabling replicative immortality']
1355514.6,The sequential order of transfection with SV40 T-antigen and ras influenced radio-sensitivity but not the induction of morphological changes .,['genomic instability and mutation']
12674770.4,"G1 arrest was observed 72 h after infection with Ad-p16 , but apoptosis was not obvious .",['resisting cell death']
12674770.6,The occurrence time of subcutaneous tumor was delayed and the tumor volume in 4 weeks was diminished by using Ad-p53 combined with Ad-p16 and the difference was significant compared with using Ad-p53 or Ad-p16 alone .,['resisting cell death']
12478469.3,"To provide a frame of reference , the phenotype of HT29 death was compared to four other TNF family receptor triggered death events ; Fas induced Jurkat cell apoptosis , TNF/zVAD induced L929 fibroblast necrosis , TNF induced death of WEHI 164 fibroblastoid cells and TNF/zVAD induced U937 death .",['resisting cell death']
12446587.4,"LNCaP/sHB tumors also expressed higher levels of the neuroendocrine marker , neuron-specific enolase , compared with control tumors .",['sustaining proliferative signaling']
12446587.6,"In vitro , AR protein levels were reduced in LNCaP/sHB cells , and in transient transfection assays using an androgen-responsive promoter ( mouse mammary tumor virus-long terminal repeat ) , LNCaP/sHB cells showed reduced sensitivity to dihydrotestosterone compared with controls .",['sustaining proliferative signaling']
12446587.8,These findings also emphasize the potential role of pathways other than the AR axis in acquisition of androgen independence .,['sustaining proliferative signaling']
12509290.8,"There is no observable TCR of these lesions in specific genes in DNA repair proficient cells ; however , it is possible that the rapid repair of these adducts by BER masks any TCR .",['genomic instability and mutation']
12509290.11,"Furthermore , repair of 3MeA in this region is highly dependent on Aag , but repair of 7MeG is equally efficient in the repair proficient , BER deficient , and NER deficient cell lines .",['genomic instability and mutation']
12509290.12,"Strikingly , in the absence of both BER and NER , neither 7MeG nor 3MeA is repaired .",['genomic instability and mutation']
12509290.13,"These results demonstrate that NER , but not TCR , contributes to the repair of 7MeG , and to a lesser extent 3MeA .",['genomic instability and mutation']
23542175.4,"Correspondingly , inhibition of PKCɛ in a TNBC cell model results in growth defects in two-dimensional ( 2D ) and three-dimensional ( 3D ) culture conditions and orthotopic xenografts .",['evading growth suppressors']
22170031.6,"An immunohistochemical analysis revealed that , erlotinib significantly suppressed the number of osteoclasts in bone metastases , whereas no difference was seen in microvessel density .",['activating invasion and metastasis']
22170031.8,These results strongly suggested that erlotinib prevented bone metastases by affecting host microenvironments irrespective of its direct effect on tumor cells .,['sustaining proliferative signaling']
11812999.8,"Immortalization by DRIL1 , whose product binds the pRB-controlled transcription factor E2F1 ( ref. 8 ) , is correlated with induction of E2F1 activity .",['enabling replicative immortality']
11812999.9,"Correspondingly , DRIL1 induces the E2F1 target Cyclin E1 , overexpression of which is sufficient to trigger escape from senescence .",['enabling replicative immortality']
21557329.6,In the WT mice inflammation returned to the basal level to a greater extent when compared to the KO mice .,['tumor promoting inflammation']
21557329.7,SFN treatment of Nrf2 WT but not Nrf2 KO mice restored the number of sunburn cells back to their basal level by 8 d after UVB irradiation .,['tumor promoting inflammation']
21557329.9,"Taken together , our results show that functional Nrf2 confers a protective effect against UVB-induced inflammation , sunburn reaction , and SFN-mediated photoprotective effects in the skin .",['tumor promoting inflammation']
23236487.6,"In contrast , mice treated with radiation exhibit no differences in the percentage of cells in G(2)/M when compared to unirradiated controls .",['sustaining proliferative signaling']
23236487.7,"Similar to previous studies utilizing IGF-1 , pretreatment with Roscovitine leads to a significant up-regulation of p21 expression and a significant decrease in the number of PCNA positive cells .",['sustaining proliferative signaling']
23144724.8,We further show that autophagic and pyroptotic proteins are unaffected by the compound and that necrotic signaling in these cells coincided with production of reactive oxygen species and calcium influx into the cytoplasm .,['resisting cell death']
23484085.6,We further demonstrate that whole blood may serve as a convenient alternative to the isolated lymphocytes in mtDNA analysis .,['genomic instability and mutation']
1315291.4,"None of the clones showed a significant response to serotonin alone in DNA synthesis reinitiation experiments , but synergy was observed between serotonin and the tyrosine kinase activating growth factors EGF and FGF .",['sustaining proliferative signaling']
1315291.5,"However , the major part of this effect could be abolished by an antagonist of 5-HT1b receptors , which are endogenous in CCL39 cells .",['sustaining proliferative signaling']
1315291.6,The same receptor was found to mediate a significant mitogenic response to the neurotransmitter in Ha-ras-transfected cells .,['sustaining proliferative signaling']
1315291.7,"The fact that 5-HT1c receptors do not readily induce a transformed phenotype in CCL39 cells clearly distinguishes them from strong dominantly acting oncogene products like RAS , SRC , or FMS .",['sustaining proliferative signaling']
20426969.7,"Logistic regression analysis showed that there was significant association between the genotypes of XRCC1 194 , XRCC1 399 , XPD 751 , CYP2E1 and DNA damages .",['genomic instability and mutation']
20426969.8,"A prominent risk decreasing of DNA damage was observed for those individuals possessing XRCC1 399Arg/Gln + Gln/Gln genotypes ( OR : 0.35 , 95%CI : 0.12 approximately 1.01 , respectively ) ; The results also showed that there were significant associations between CYP2E1 c1c2/c2c2 and DNA damage both in high and low VCM-exposed groups ( OR : 2.57 , 95%CI : 1.01 approximately 6.59 and OR : 2.57 , 95%CI : 0.99 approximately 6.87 ) .",['genomic instability and mutation']
20190804.4,"Elevation of p27(Kip1) was associated with decreased expression and activity of the oncogenic transcription factor FoxM1 , a known regulator of p27(Kip1) stability through transcriptional control of Skp2 .",['evading growth suppressors']
20190804.5,"Reducing O-GlcNAc levels in breast cancer cells decreased levels of FoxM1 protein and caused a decrease in multiple FoxM1-specific targets , including Skp2 .",['evading growth suppressors']
12387751.4,Loss of G1 arrest was also shown by flow cytometric analysis .,['evading growth suppressors']
12387751.5,We demonstrate that TCDD treatment significantly increases cyclin D2 and cyclin A protein levels and show by immunofluorescence that these proteins accumulate in the nucleus .,['sustaining proliferative signaling']
12387751.6,"Although TCDD treatment leads to a strong increase in cyclin D2/cdk4 and cyclin A/cdk2 complex formation , we could only detect an elevation of cyclin A/cdk2 activity .",['sustaining proliferative signaling']
12387751.7,"In accordance with a lack of elevated cdk4 activity , no decrease in the amount of hypophosphorylated retinoblastoma protein could be shown after TCDD treatment .",['sustaining proliferative signaling']
12387751.8,The importance of increased cyclin A/cdk2 activity for TCDD-dependent release from contact inhibition was shown by the fact that the cdk2/cdc2-specific inhibitor olomoucine ( 25 microM ) abolished TCDD response .,['sustaining proliferative signaling']
22577350.9,This strategy was independent of the adaptive immune system .,['tumor promoting inflammation']
22577350.10,"Together , these data suggest that vascular-targeted strategies directed against exposed PS may be a powerful adjunct to postoperative chemotherapy in preventing relapses after cancer surgery .",['tumor promoting inflammation']
20008136.5,"Moreover , overexpression of WNT5A drastically increased LS-8 cell migration and actin reorganization when compared with controls .",['evading growth suppressors']
1582349.3,No significant differences in EGF receptors were found between colonic cancer tissue and the surrounding normal tissues .,['sustaining proliferative signaling']
1332809.2,"A striking declination in CD8+ cells were found only after R3 operation ; ( 4 ) after a short period ( 10-14 days ) or a long period ( 2-4 years ) of radical gastrectomy , NK cell activity and T-lymphocyte subsets showed no significant differences between R2+ and R3 operation .",['avoiding immune destruction']
1332809.4,"For these reasons , a complete tumor resection would be necessary to improve the immunocompetence , and the combined splenectomy might be advisable if indicated .",['avoiding immune destruction']
23420486.4,"From a pharmacological standpoint , when assessing cell growth inhibition using a median-dose analysis algorithm , the interaction between mifepristone and LY294002 was synergistic .",['resisting cell death']
20664062.3,"In contrast to that previously described for senescence in other cell types , the SENEX induced senescent ECs are profoundly anti-inflammatory .",['enabling replicative immortality']
20664062.5,Furthermore they are resistant to thrombin induced vascular leak .,['resisting cell death']
20664062.8,"Together , these findings expand our understanding of the role of senescence in the vasculature and identify SENEX as a fulcrum for driving the resultant phenotype of the endothelium after activation .",['resisting cell death']
21049082.8,"Thus , reduced metabolic activity is not a hallmark of the quiescent state .",['cellular energetics']
21187506.6,Results suggest targeted agents such as sunitinib may be an effective treatment for bone metastases .,['activating invasion and metastasis']
23174591.5,CONCLUSIONS The down-regulated expression of miR-216a in pancreatic cancer suggests the involvement of miR-216a in the tumorigenesis and development of pancreatic cancer. miR-216a may potentially serve as a novel tumor marker and also a prognostic factor for pancreatic cancer .,['activating invasion and metastasis']
1458479.13,We suggest that novel expression of gastrin ( CCK-B ) receptors may be generated by gene mutation or amplification during carcinogenesis and may play an important role in promoting tumor growth .,['sustaining proliferative signaling']
22969901.6,"Further multivariate analysis revealed that patient gender , depth of tumor invasion , distant metastasis , TNM stage and the expression of RASSF2 were independent prognostic factors for patients with gastric cancer .",['activating invasion and metastasis']
22969901.7,"The Kaplan-Meier plot showed that the overall mean survival time of the patients with RASSF2-negative expression was shorter than that of patients with positive expression ( χ(2)=156.874 , P<0.0001 ) .",['activating invasion and metastasis']
12458342.4,"In contrast , fucosyl residue contributes more than sialyl residue to cell adhesion to Fn and Ln , but less to adhesion to HUVEC , and is not essential in chemotactic cell migration and invasion .",['activating invasion and metastasis']
12458342.5,"Cell adhesion to HUVEC , migration , and invasion were inhibited by the monoclonal antibody of sialyl Lewis X , but not by the antibody of non-sialyl Lewis X. CONCLUSION Terminal sialyl residues on cell surface glycans are more important than fucosyl residues in mediating cell adhesion to HUVEC and cell migration/invasion , but the reverse is true in cell adhesion to Fn and Ln .",['activating invasion and metastasis']
20683149.5,We also analyzed the relationship of the mutation data between the clinical and biological data of the patients .,['genomic instability and mutation']
12231192.10,"Thus , a high dermal mast cell prevalence as demonstrable in buttock skin is a significant predisposing factor for development of BCC in humans .",['avoiding immune destruction']
21087507.5,"Inhibition of ER signalling by the pure anti-oestrogen ICI 182,780 decreased the effect of hMSCs on MCF-7 cell proliferation and migration supporting a role for ER signalling in the hMSC/MCF-7 cell interaction .",['activating invasion and metastasis']
21087507.6,"Additionally , hMSCs have been shown to secrete a wide variety of growth factors and chemokines including stromal cell-derived factor-1 ( SDF-1 ) .",['sustaining proliferative signaling']
21087507.7,This coupled with the knowledge that SDF-1 is an ER-mediated gene linked with hormone-independence and metastasis led to the investigation of the SDF-1/CXCR4 signalling axis in hMSC-MCF-7 cell interaction .,['sustaining proliferative signaling']
21087507.12,CONCLUSIONS The sum of these data reveals the relationship between tumour microenvironment and tumour growth and progression .,['sustaining proliferative signaling']
11978176.2,"Subsequently , with the increase in cell passages , the copy number of the exogenously transfected hTERT gene and the percentage of SA-beta-gal positive cells were found to decrease .",['enabling replicative immortality']
1516065.4,"In addition , we noted changes in cell morphology and keratin expression of EGF-stimulated ZR/HERc cells , suggestive of an altered differentiation state .",['sustaining proliferative signaling']
1516065.5,"Furthermore , intolerance of functional ER and EGF receptor signal transduction pathways in ZR/HERc cells was observed during simultaneous activation , which possibly explains the inverse relationship of ER and EGF receptor expression in primary tumors .",['sustaining proliferative signaling']
12461298.7,This phosphorylation is partially dependent upon the Polo-like kinase Cdc5 and is consistent with negative regulation of the Bub2/Bfa1 GAP complex .,['sustaining proliferative signaling']
12461298.11,Bub2 phosphorylation is likely to be controlled by a novel kinase .,['evading growth suppressors']
23140147.7,"CONCLUSIONS Given previous evidence indicating a role for PlGF in promoting angiogenesis , inflammatory cell chemotaxis , and stimulation , as well as its ability to amplify VEGF-driven signaling under conditions favoring pathological angiogenesis , enhanced expression of PlGF in hematoma fluid suggests the involvement of this factor in the mechanisms of inflammation and angiogenesis in CSDH .",['inducing angiogenesis']
23140147.9,Future studies are warranted to clarify the precise role of PlGF and sVEGFR-1 in CSDH .,['inducing angiogenesis']
12230501.5,"No immune suppression was found in ultraviolet-irradiated mice injected with monoclonal anti-interleukin-10 antibody , or mice exposed to solar-simulated ultraviolet radiation and injected with recombinant interleukin-12 .",['avoiding immune destruction']
12230501.6,Suppressor lymphocytes were found in the spleens of mice exposed to ultraviolet A + B radiation .,['avoiding immune destruction']
12230501.10,"Moreover , our findings demonstrate that ultraviolet radiation activates similar immunologic pathways to suppress the induction of , or the elicitation of , the immune response .",['avoiding immune destruction']
23255243.8,The results were reproduced in vitro with a cell culture model .,['resisting cell death']
23255243.11,CONCLUSIONS: : Akt plays an important role in the radiation-induced tumor-infiltrating Treg survival in Hca .,['avoiding immune destruction']
23255914.6,The mechanism may involve regulation of the expression of Bcl-2 family proteins .,['resisting cell death']
12429974.8,The cell cycle progression of lymphocytes that responded to PHA mitogenically was not affected at 8.3 or 83 nM Onc concentration .,['resisting cell death']
23255900.6,"Combined treatment was found to increase CTL cytotoxicity , increase the number of CTLs and NK cells in splenocytes , upregulate the cytokines IFN-γ and IL-2 and downregulate IL-10 .",['avoiding immune destruction']
12370496.3,"However , concentrations and times necessary for these effects to occur were different , aclarubicin being the quickest acting drug with a lag phase of 3 h , followed by daunorubicin with 6 h and doxorubicin with 24 h .",['resisting cell death']
23274058.5,Knockdown of p21 using specific siRNAs partially abrogated jaceosidin-induced cell growth inhibition .,['sustaining proliferative signaling']
22973555.4,The MAP17-dependent increase in ROS and tumorigenesis relies on its PDZ-binding domain because disruption of this sequence by point mutations abolishes the ability of MAP17 to enhance ROS production and tumorigenesis .,['tumor promoting inflammation']
22973555.5,"MAP17 is overexpressed in a great variety of human carcinomas , including breast tumors .",['genomic instability and mutation']
